item_id,description,category,quantity,notes
ITM01,Laptop XPS 15,Electronics,10,High performance model for developers. Pre-install requested software.
ITM02,Office Chair Ergonomic,Furniture,25,Ensure all chairs have lumbar support. Check assembly.
ITM03,Coffee Beans Dark Roast,Groceries,50,Organic, fair-trade certified. Source from Colombia.
ITM04,Projector HD 1080p,Electronics,5,Include HDMI cables and remote controls for each.
ITM05,Whiteboard Magnetic Large,Office Supplies,15,Markers and erasers needed. Wall mounting kits.
ITM06,Desk Lamp LED Adjustable,Furniture,30,Energy efficient bulbs preferred. Modern design.
ITM07,Notebook A5 Lined,Stationery,100,Recycled paper. Various cover colors.
